{
  "bbox": {
    "x0": 0.069444,
    "x1": 0.93056,
    "y0": 0.12037,
    "y1": 0.875
  },
  "confidence": {
    "review_required": true,
    "source": "engine",
    "value": 1.0
  },
  "data": {
    "edges": [
      {
        "bbox": {
          "x0": 0.49306,
          "x1": 0.50694,
          "y0": 0.18056,
          "y1": 0.22222
        },
        "condition": null,
        "from": "node1",
        "to": "node2"
      },
      {
        "bbox": {
          "x0": 0.19444,
          "x1": 0.30556,
          "y0": 0.27315,
          "y1": 0.80556
        },
        "condition": "いいえ",
        "from": "node2",
        "to": "node5"
      },
      {
        "bbox": {
          "x0": 0.49306,
          "x1": 0.50694,
          "y0": 0.32407,
          "y1": 0.37037
        },
        "condition": "はい",
        "from": "node2",
        "to": "node3"
      },
      {
        "bbox": {
          "x0": 0.69444,
          "x1": 0.76389,
          "y0": 0.4213,
          "y1": 0.80556
        },
        "condition": "いいえ",
        "from": "node3",
        "to": "node6"
      },
      {
        "bbox": {
          "x0": 0.49306,
          "x1": 0.50694,
          "y0": 0.47222,
          "y1": 0.51852
        },
        "condition": "はい",
        "from": "node3",
        "to": "node4"
      },
      {
        "bbox": {
          "x0": 0.19444,
          "x1": 0.30556,
          "y0": 0.56944,
          "y1": 0.80556
        },
        "condition": "いいえ",
        "from": "node4",
        "to": "node5"
      },
      {
        "bbox": {
          "x0": 0.69444,
          "x1": 0.80556,
          "y0": 0.56944,
          "y1": 0.80556
        },
        "condition": "はい",
        "from": "node4",
        "to": "node7"
      }
    ],
    "nodes": [
      {
        "bbox": {
          "x0": 0.34167,
          "x1": 0.65833,
          "y0": 0.12037,
          "y1": 0.18056
        },
        "id": "node1",
        "node_type": "start",
        "text": "申請内容を確認"
      },
      {
        "bbox": {
          "x0": 0.30556,
          "x1": 0.69444,
          "y0": 0.22222,
          "y1": 0.32407
        },
        "id": "node2",
        "node_type": "decision",
        "text": "対象職員か"
      },
      {
        "bbox": {
          "x0": 0.30556,
          "x1": 0.69444,
          "y0": 0.37037,
          "y1": 0.47222
        },
        "id": "node3",
        "node_type": "decision",
        "text": "必要書類が揃っているか"
      },
      {
        "bbox": {
          "x0": 0.30556,
          "x1": 0.69444,
          "y0": 0.51852,
          "y1": 0.62037
        },
        "id": "node4",
        "node_type": "decision",
        "text": "支給要件を満たすか"
      },
      {
        "bbox": {
          "x0": 0.069444,
          "x1": 0.33333,
          "y0": 0.80556,
          "y1": 0.875
        },
        "id": "node5",
        "node_type": "end",
        "text": "支給対象外"
      },
      {
        "bbox": {
          "x0": 0.36111,
          "x1": 0.63889,
          "y0": 0.80556,
          "y1": 0.875
        },
        "id": "node6",
        "node_type": "end",
        "text": "追加提出を依頼"
      },
      {
        "bbox": {
          "x0": 0.66667,
          "x1": 0.93056,
          "y0": 0.80556,
          "y1": 0.875
        },
        "id": "node7",
        "node_type": "end",
        "text": "支給対象"
      }
    ],
    "type": "flowchart"
  },
  "kind": "flowchart",
  "page": 1,
  "schema_version": "1.0",
  "source_image_sha256": "5555555555555555555555555555555555555555555555555555555555555555",
  "title": "住居手当 支給可否判断フロー（架空）"
}
