{
  "bbox": {
    "x0": 0.0688,
    "x1": 0.9312,
    "y0": 0.2199,
    "y1": 0.6722
  },
  "confidence": {
    "review_required": true,
    "source": "engine",
    "value": 1.0
  },
  "data": {
    "fields": [
      {
        "bbox": {
          "x0": 0.0688,
          "x1": 0.4531,
          "y0": 0.2198,
          "y1": 0.2967
        },
        "example_value": "123456",
        "id": "field_01",
        "label": "職員番号"
      },
      {
        "bbox": {
          "x0": 0.5025,
          "x1": 0.9312,
          "y0": 0.2198,
          "y1": 0.2967
        },
        "example_value": "給与 花子（架空）",
        "id": "field_02",
        "label": "氏名"
      },
      {
        "bbox": {
          "x0": 0.0688,
          "x1": 0.4531,
          "y0": 0.3445,
          "y1": 0.4214
        },
        "example_value": "2026年4月1日",
        "id": "field_03",
        "label": "異動年月日"
      },
      {
        "bbox": {
          "x0": 0.5025,
          "x1": 0.9312,
          "y0": 0.3445,
          "y1": 0.4214
        },
        "example_value": "給与 一郎（架空）",
        "id": "field_04",
        "label": "扶養親族氏名"
      },
      {
        "bbox": {
          "x0": 0.0688,
          "x1": 0.4531,
          "y0": 0.4692,
          "y1": 0.5461
        },
        "example_value": "子",
        "id": "field_05",
        "label": "続柄"
      },
      {
        "bbox": {
          "x0": 0.5025,
          "x1": 0.9312,
          "y0": 0.4692,
          "y1": 0.5461
        },
        "example_value": "出生",
        "id": "field_06",
        "label": "異動理由"
      },
      {
        "bbox": {
          "x0": 0.0688,
          "x1": 0.9312,
          "y0": 0.5953,
          "y1": 0.6722
        },
        "example_value": "住民票の写し",
        "id": "field_07",
        "label": "添付書類"
      }
    ],
    "type": "form"
  },
  "kind": "form",
  "page": 1,
  "schema_version": "1.0",
  "source_image_sha256": "e2c0e02e97fc1877d099b8e07cce2184fa66bdaf1f84d6d58ab2c02c7ad7545e",
  "title": "扶養手当認定届 記入例"
}
