{
  "bbox": {
    "x0": 0.075,
    "x1": 0.925,
    "y0": 0.17143,
    "y1": 0.7
  },
  "confidence": {
    "review_required": true,
    "source": "engine",
    "value": 1.0
  },
  "data": {
    "edges": [
      {
        "bbox": {
          "x0": 0.495,
          "x1": 0.505,
          "y0": 0.23095,
          "y1": 0.28571
        },
        "condition": null,
        "from": "node1",
        "to": "node2"
      },
      {
        "bbox": {
          "x0": 0.495,
          "x1": 0.505,
          "y0": 0.35476,
          "y1": 0.40952
        },
        "condition": null,
        "from": "node2",
        "to": "node3"
      },
      {
        "bbox": {
          "x0": 0.26,
          "x1": 0.285,
          "y0": 0.4619,
          "y1": 0.61905
        },
        "condition": "不一致",
        "from": "node3",
        "to": "node4"
      },
      {
        "bbox": {
          "x0": 0.715,
          "x1": 0.74,
          "y0": 0.4619,
          "y1": 0.61905
        },
        "condition": "一致",
        "from": "node3",
        "to": "node5"
      }
    ],
    "nodes": [
      {
        "bbox": {
          "x0": 0.31875,
          "x1": 0.68125,
          "y0": 0.17143,
          "y1": 0.23095
        },
        "id": "node1",
        "node_type": "start",
        "text": "登録票の到着"
      },
      {
        "bbox": {
          "x0": 0.285,
          "x1": 0.715,
          "y0": 0.28571,
          "y1": 0.35476
        },
        "id": "node2",
        "node_type": "process",
        "text": "活動記録と登録票を照合"
      },
      {
        "bbox": {
          "x0": 0.285,
          "x1": 0.715,
          "y0": 0.40952,
          "y1": 0.51429
        },
        "id": "node3",
        "node_type": "decision",
        "text": "記録は一致？"
      },
      {
        "bbox": {
          "x0": 0.075,
          "x1": 0.445,
          "y0": 0.61905,
          "y1": 0.7
        },
        "id": "node4",
        "node_type": "end",
        "text": "差異票を発行 照会待ちで終了"
      },
      {
        "bbox": {
          "x0": 0.555,
          "x1": 0.925,
          "y0": 0.61905,
          "y1": 0.7
        },
        "id": "node5",
        "node_type": "end",
        "text": "交換台帳へ登録 受付番号を通知"
      }
    ],
    "type": "flowchart"
  },
  "kind": "flowchart",
  "page": 1,
  "schema_version": "1.0",
  "source_image_sha256": "5876876876876876876876876876876876876876876876876876876876876876",
  "title": "技能交換登録の処理経路（架空）"
}
