{
  "bbox": {
    "x0": 0.28889,
    "x1": 0.71111,
    "y0": 0.19333,
    "y1": 0.85333
  },
  "confidence": {
    "review_required": true,
    "source": "provider_self_report",
    "value": 1.0
  },
  "data": {
    "edges": [
      {
        "bbox": {
          "x0": 0.49444,
          "x1": 0.50556,
          "y0": 0.25333,
          "y1": 0.29333
        },
        "condition": null,
        "from": "node1",
        "to": "node2"
      },
      {
        "bbox": {
          "x0": 0.25,
          "x1": 0.5,
          "y0": 0.40667,
          "y1": 0.47333
        },
        "condition": "はい",
        "from": "node2",
        "to": "node3"
      },
      {
        "bbox": {
          "x0": 0.5,
          "x1": 0.75,
          "y0": 0.40667,
          "y1": 0.47333
        },
        "condition": "いいえ",
        "from": "node2",
        "to": "node4"
      },
      {
        "bbox": {
          "x0": 0.49444,
          "x1": 0.50556,
          "y0": 0.54667,
          "y1": 0.62667
        },
        "condition": null,
        "from": "node3",
        "to": "node5"
      },
      {
        "bbox": {
          "x0": 0.49444,
          "x1": 0.50556,
          "y0": 0.54667,
          "y1": 0.62667
        },
        "condition": null,
        "from": "node4",
        "to": "node5"
      },
      {
        "bbox": {
          "x0": 0.49444,
          "x1": 0.50556,
          "y0": 0.7,
          "y1": 0.78
        },
        "condition": null,
        "from": "node5",
        "to": "node6"
      }
    ],
    "nodes": [
      {
        "bbox": {
          "x0": 0.33111,
          "x1": 0.66889,
          "y0": 0.19333,
          "y1": 0.25333
        },
        "id": "node1",
        "node_type": "start",
        "text": "照合依頼を受領"
      },
      {
        "bbox": {
          "x0": 0.28889,
          "x1": 0.71111,
          "y0": 0.29333,
          "y1": 0.40667
        },
        "id": "node2",
        "node_type": "decision",
        "text": "当月の計算は締切済みか"
      },
      {
        "bbox": {
          "x0": 0.066667,
          "x1": 0.43333,
          "y0": 0.47333,
          "y1": 0.54667
        },
        "id": "node3",
        "node_type": "process",
        "text": "訂正予約票を作成"
      },
      {
        "bbox": {
          "x0": 0.56667,
          "x1": 0.93333,
          "y0": 0.47333,
          "y1": 0.54667
        },
        "id": "node4",
        "node_type": "process",
        "text": "仮計算台帳に追記"
      },
      {
        "bbox": {
          "x0": 0.32222,
          "x1": 0.67778,
          "y0": 0.62667,
          "y1": 0.7
        },
        "id": "node5",
        "node_type": "process",
        "text": "照合管理簿に登録"
      },
      {
        "bbox": {
          "x0": 0.28889,
          "x1": 0.71111,
          "y0": 0.78,
          "y1": 0.85333
        },
        "id": "node6",
        "node_type": "end",
        "text": "受付番号を通知して終了"
      }
    ],
    "type": "flowchart"
  },
  "kind": "flowchart",
  "page": 1,
  "schema_version": "1.0",
  "source_image_sha256": "e3b0c44298fc1c149afbf4c8996fb92427ae41e4649b934ca495991b7852b855",
  "title": "給与控除照合依頼の受付経路"
}
