{
  "bbox": {
    "x0": 0.0694,
    "x1": 0.9306,
    "y0": 0.22306,
    "y1": 0.51111
  },
  "confidence": {
    "review_required": true,
    "source": "engine",
    "value": 1.0
  },
  "data": {
    "cells": [
      {
        "bbox": {
          "x0": 0.0694,
          "x1": 0.2389,
          "y0": 0.2231,
          "y1": 0.2972
        },
        "column": 0,
        "column_span": 1,
        "row": 0,
        "row_span": 1,
        "text": "職員区分"
      },
      {
        "bbox": {
          "x0": 0.2389,
          "x1": 0.4556,
          "y0": 0.2231,
          "y1": 0.2972
        },
        "column": 1,
        "column_span": 1,
        "row": 0,
        "row_span": 1,
        "text": "通勤回数"
      },
      {
        "bbox": {
          "x0": 0.4556,
          "x1": 0.6417,
          "y0": 0.2231,
          "y1": 0.2972
        },
        "column": 2,
        "column_span": 1,
        "row": 0,
        "row_span": 1,
        "text": "月額"
      },
      {
        "bbox": {
          "x0": 0.6417,
          "x1": 0.9306,
          "y0": 0.2231,
          "y1": 0.2972
        },
        "column": 3,
        "column_span": 1,
        "row": 0,
        "row_span": 1,
        "text": "備考"
      },
      {
        "bbox": {
          "x0": 0.0694,
          "x1": 0.2389,
          "y0": 0.2972,
          "y1": 0.4389
        },
        "column": 0,
        "column_span": 1,
        "row": 1,
        "row_span": 2,
        "text": "常勤職員"
      },
      {
        "bbox": {
          "x0": 0.2389,
          "x1": 0.4556,
          "y0": 0.2972,
          "y1": 0.3681
        },
        "column": 1,
        "column_span": 1,
        "row": 1,
        "row_span": 1,
        "text": "月15日以上"
      },
      {
        "bbox": {
          "x0": 0.4556,
          "x1": 0.6417,
          "y0": 0.2972,
          "y1": 0.3681
        },
        "column": 2,
        "column_span": 1,
        "row": 1,
        "row_span": 1,
        "text": "12,000円"
      },
      {
        "bbox": {
          "x0": 0.6417,
          "x1": 0.9306,
          "y0": 0.2972,
          "y1": 0.3681
        },
        "column": 3,
        "column_span": 1,
        "row": 1,
        "row_span": 1,
        "text": "上限額"
      },
      {
        "bbox": {
          "x0": 0.2389,
          "x1": 0.4556,
          "y0": 0.3681,
          "y1": 0.4389
        },
        "column": 1,
        "column_span": 1,
        "row": 2,
        "row_span": 1,
        "text": "月8～14日"
      },
      {
        "bbox": {
          "x0": 0.4556,
          "x1": 0.6417,
          "y0": 0.3681,
          "y1": 0.4389
        },
        "column": 2,
        "column_span": 1,
        "row": 2,
        "row_span": 1,
        "text": "8,000円"
      },
      {
        "bbox": {
          "x0": 0.6417,
          "x1": 0.9306,
          "y0": 0.3681,
          "y1": 0.4389
        },
        "column": 3,
        "column_span": 1,
        "row": 2,
        "row_span": 1,
        "text": "日数に応じる"
      },
      {
        "bbox": {
          "x0": 0.0694,
          "x1": 0.2389,
          "y0": 0.4389,
          "y1": 0.5111
        },
        "column": 0,
        "column_span": 1,
        "row": 3,
        "row_span": 1,
        "text": "短時間職員"
      },
      {
        "bbox": {
          "x0": 0.2389,
          "x1": 0.4556,
          "y0": 0.4389,
          "y1": 0.5111
        },
        "column": 1,
        "column_span": 1,
        "row": 3,
        "row_span": 1,
        "text": "月1～7日"
      },
      {
        "bbox": {
          "x0": 0.4556,
          "x1": 0.6417,
          "y0": 0.4389,
          "y1": 0.5111
        },
        "column": 2,
        "column_span": 1,
        "row": 3,
        "row_span": 1,
        "text": "4,000円"
      },
      {
        "bbox": {
          "x0": 0.6417,
          "x1": 0.9306,
          "y0": 0.4389,
          "y1": 0.5111
        },
        "column": 3,
        "column_span": 1,
        "row": 3,
        "row_span": 1,
        "text": "最低区分"
      }
    ],
    "column_count": 4,
    "row_count": 4,
    "type": "table"
  },
  "kind": "table",
  "page": 1,
  "schema_version": "1.0",
  "source_image_sha256": "5555555555555555555555555555555555555555555555555555555555555555",
  "title": "通勤手当 支給額・区分表（架空）"
}
