{
  "bbox": {
    "x0": 0.3146,
    "x1": 0.9583,
    "y0": 0.1896,
    "y1": 0.7208
  },
  "confidence": {
    "review_required": true,
    "source": "provider_self_report",
    "value": 1.0
  },
  "data": {
    "edges": [
      {
        "bbox": {
          "x0": 0.4995,
          "x1": 0.5005,
          "y0": 0.2417,
          "y1": 0.275
        },
        "condition": null,
        "from": "node1",
        "to": "node2"
      },
      {
        "bbox": {
          "x0": 0.6854,
          "x1": 0.8396,
          "y0": 0.3271,
          "y1": 0.4042
        },
        "condition": "いいえ",
        "from": "node2",
        "to": "node3"
      },
      {
        "bbox": {
          "x0": 0.4995,
          "x1": 0.5005,
          "y0": 0.3792,
          "y1": 0.4708
        },
        "condition": "はい",
        "from": "node2",
        "to": "node4"
      },
      {
        "bbox": {
          "x0": 0.1646,
          "x1": 0.3146,
          "y0": 0.5229,
          "y1": 0.625
        },
        "condition": "いいえ",
        "from": "node4",
        "to": "node5"
      },
      {
        "bbox": {
          "x0": 0.4995,
          "x1": 0.5005,
          "y0": 0.575,
          "y1": 0.6438
        },
        "condition": "はい",
        "from": "node4",
        "to": "node6"
      }
    ],
    "nodes": [
      {
        "bbox": {
          "x0": 0.3146,
          "x1": 0.6854,
          "y0": 0.1896,
          "y1": 0.2417
        },
        "id": "node1",
        "node_type": "start",
        "text": "当日の記録を確認"
      },
      {
        "bbox": {
          "x0": 0.3146,
          "x1": 0.6854,
          "y0": 0.275,
          "y1": 0.3792
        },
        "id": "node2",
        "node_type": "decision",
        "text": "実作業時間は45分以上か"
      },
      {
        "bbox": {
          "x0": 0.7208,
          "x1": 0.9583,
          "y0": 0.4042,
          "y1": 0.4813
        },
        "id": "node3",
        "node_type": "end",
        "text": "時間不足で認定対象外"
      },
      {
        "bbox": {
          "x0": 0.3146,
          "x1": 0.6854,
          "y0": 0.4708,
          "y1": 0.575
        },
        "id": "node4",
        "node_type": "decision",
        "text": "事前講習は修了済みか"
      },
      {
        "bbox": {
          "x0": 0.0458,
          "x1": 0.2833,
          "y0": 0.625,
          "y1": 0.7021
        },
        "id": "node5",
        "node_type": "end",
        "text": "講習修了まで認定保留"
      },
      {
        "bbox": {
          "x0": 0.3312,
          "x1": 0.6687,
          "y0": 0.6438,
          "y1": 0.7208
        },
        "id": "node6",
        "node_type": "end",
        "text": "従事認定"
      }
    ],
    "type": "flowchart"
  },
  "kind": "flowchart",
  "page": 1,
  "schema_version": "1.0",
  "source_image_sha256": "c68d8d8dcbf028e01c6766ba61d862139d06f1269b473921b04c07adbd341503",
  "title": "資料整理従事の認定判定"
}
