{
  "bbox": {
    "x0": 0.0694,
    "x1": 0.9306,
    "y0": 0.17361,
    "y1": 0.7875
  },
  "confidence": {
    "review_required": true,
    "source": "provider_self_report",
    "value": 1.0
  },
  "data": {
    "events": [
      {
        "action": "扶養状況の変更を確認",
        "bbox": {
          "x0": 0.0694,
          "x1": 0.9306,
          "y0": 0.1736,
          "y1": 0.2472
        },
        "date_or_offset": "異動日",
        "id": "event_1"
      },
      {
        "action": "職員が届出書と確認書類を提出",
        "bbox": {
          "x0": 0.0694,
          "x1": 0.9306,
          "y0": 0.3056,
          "y1": 0.3792
        },
        "date_or_offset": "翌日から10日以内",
        "id": "event_2"
      },
      {
        "action": "給与担当者が届出内容を確認",
        "bbox": {
          "x0": 0.0694,
          "x1": 0.9306,
          "y0": 0.4444,
          "y1": 0.5181
        },
        "date_or_offset": "受領後2営業日以内",
        "id": "event_3"
      },
      {
        "action": "給与システムへ登録",
        "bbox": {
          "x0": 0.0694,
          "x1": 0.9306,
          "y0": 0.5778,
          "y1": 0.6514
        },
        "date_or_offset": "当月給与の締切日まで",
        "id": "event_4"
      },
      {
        "action": "認定した手当額を反映",
        "bbox": {
          "x0": 0.0694,
          "x1": 0.9306,
          "y0": 0.7139,
          "y1": 0.7875
        },
        "date_or_offset": "翌月給与",
        "id": "event_5"
      }
    ],
    "type": "timeline"
  },
  "kind": "timeline",
  "page": 1,
  "schema_version": "1.0",
  "source_image_sha256": "e3b0c44298fc1c149afbf4c8996fb92427ae41e4649b934ca495991b7852b855",
  "title": "扶養手当 申請期限タイムライン（架空）"
}
