{
  "bbox": {
    "x0": 0.0694,
    "x1": 0.9306,
    "y0": 0.25556,
    "y1": 0.7153
  },
  "confidence": {
    "review_required": true,
    "source": "provider_self_report",
    "value": 1.0
  },
  "data": {
    "fields": [
      {
        "bbox": {
          "x0": 0.0694,
          "x1": 0.9306,
          "y0": 0.25556,
          "y1": 0.33333
        },
        "example_value": "RC-482",
        "id": "field_1",
        "label": "照会受付番号"
      },
      {
        "bbox": {
          "x0": 0.0694,
          "x1": 0.9306,
          "y0": 0.35069,
          "y1": 0.42847
        },
        "example_value": "U-26",
        "id": "field_2",
        "label": "受取部署コード"
      },
      {
        "bbox": {
          "x0": 0.0694,
          "x1": 0.9306,
          "y0": 0.44583,
          "y1": 0.52361
        },
        "example_value": "庁内連絡便",
        "id": "field_3",
        "label": "通知方法"
      },
      {
        "bbox": {
          "x0": 0.0694,
          "x1": 0.9306,
          "y0": 0.54167,
          "y1": 0.61944
        },
        "example_value": "B-19",
        "id": "field_4",
        "label": "受取ボックス番号"
      },
      {
        "bbox": {
          "x0": 0.0694,
          "x1": 0.9306,
          "y0": 0.6375,
          "y1": 0.7153
        },
        "example_value": "2028年5月",
        "id": "field_5",
        "label": "適用開始月"
      }
    ],
    "type": "form"
  },
  "kind": "form",
  "page": 1,
  "schema_version": "1.0",
  "source_image_sha256": "e3b0c44298fc1c149afbf4c8996fb92427ae41e4649b934ca495991b7852b855",
  "title": "給与照会連絡先登録票（記入例）"
}
