{
  "bbox": {
    "x0": 0.056667,
    "x1": 0.92333,
    "y0": 0.17143,
    "y1": 0.79643
  },
  "confidence": {
    "review_required": true,
    "source": "engine",
    "value": 0.95
  },
  "data": {
    "edges": [
      {
        "bbox": {
          "x0": 0.5,
          "x1": 0.5,
          "y0": 0.23095,
          "y1": 0.29762
        },
        "condition": null,
        "from": "node1",
        "to": "node2"
      },
      {
        "bbox": {
          "x0": 0.18833,
          "x1": 0.29333,
          "y0": 0.35714,
          "y1": 0.49762
        },
        "condition": "4時間未満",
        "from": "node2",
        "to": "node3"
      },
      {
        "bbox": {
          "x0": 0.70667,
          "x1": 0.71667,
          "y0": 0.35714,
          "y1": 0.49762
        },
        "condition": "4時間以上",
        "from": "node2",
        "to": "node4"
      },
      {
        "bbox": {
          "x0": 0.23333,
          "x1": 0.51,
          "y0": 0.55714,
          "y1": 0.72381
        },
        "condition": "未確認",
        "from": "node4",
        "to": "node5"
      },
      {
        "bbox": {
          "x0": 0.71667,
          "x1": 0.71667,
          "y0": 0.61667,
          "y1": 0.72381
        },
        "condition": "確認済み",
        "from": "node4",
        "to": "node6"
      }
    ],
    "nodes": [
      {
        "bbox": {
          "x0": 0.29333,
          "x1": 0.70667,
          "y0": 0.17143,
          "y1": 0.23095
        },
        "id": "node1",
        "node_type": "process",
        "text": "当月の夜間対応を集計"
      },
      {
        "bbox": {
          "x0": 0.29333,
          "x1": 0.70667,
          "y0": 0.29762,
          "y1": 0.41667
        },
        "id": "node2",
        "node_type": "decision",
        "text": "連続対応が4時間以上？"
      },
      {
        "bbox": {
          "x0": 0.056667,
          "x1": 0.32,
          "y0": 0.49762,
          "y1": 0.57143
        },
        "id": "node3",
        "node_type": "process",
        "text": "付与対象外"
      },
      {
        "bbox": {
          "x0": 0.51,
          "x1": 0.92333,
          "y0": 0.49762,
          "y1": 0.61667
        },
        "id": "node4",
        "node_type": "decision",
        "text": "所属責任者の確認を受けた？"
      },
      {
        "bbox": {
          "x0": 0.056667,
          "x1": 0.41,
          "y0": 0.72381,
          "y1": 0.79643
        },
        "id": "node5",
        "node_type": "process",
        "text": "確認待ちで保留"
      },
      {
        "bbox": {
          "x0": 0.51,
          "x1": 0.92333,
          "y0": 0.72381,
          "y1": 0.79643
        },
        "id": "node6",
        "node_type": "process",
        "text": "回復休を半日付与"
      }
    ],
    "type": "flowchart"
  },
  "kind": "flowchart",
  "page": 1,
  "schema_version": "1.0",
  "source_image_sha256": "5678901234567890123456789012345678901234567890123456789012345678",
  "title": "夜間対応回復休の判定（架空）"
}
