{
  "schema_version": "1.0",
  "kind": "flowchart",
  "title": "住居手当 支給可否判断フロー（架空）",
  "page": 1,
  "bbox": {
    "x0": 0.0638,
    "y0": 0.1045,
    "x1": 0.9357,
    "y1": 0.8909
  },
  "source_image_sha256": "c7b9cb134a9ed54fad74d353601d2a5c860d04d03ab78c5cd7565c097a3681f3",
  "confidence": {
    "source": "unavailable",
    "value": null,
    "review_required": true
  },
  "data": {
    "type": "flowchart",
    "nodes": [
      {
        "id": "start",
        "text": "申請内容を確認",
        "node_type": "start",
        "bbox": {
          "x0": 0.3444,
          "y0": 0.1212,
          "x1": 0.6552,
          "y1": 0.1782
        }
      },
      {
        "id": "employee",
        "text": "対象職員か",
        "node_type": "decision",
        "bbox": {
          "x0": 0.3444,
          "y0": 0.2197,
          "x1": 0.6552,
          "y1": 0.3266
        }
      },
      {
        "id": "documents",
        "text": "必要書類が揃っているか",
        "node_type": "decision",
        "bbox": {
          "x0": 0.3444,
          "y0": 0.3801,
          "x1": 0.6552,
          "y1": 0.487
        }
      },
      {
        "id": "requirements",
        "text": "支給要件を満たすか",
        "node_type": "decision",
        "bbox": {
          "x0": 0.3444,
          "y0": 0.5405,
          "x1": 0.6552,
          "y1": 0.6474
        }
      },
      {
        "id": "not_eligible",
        "text": "支給対象外",
        "node_type": "end",
        "bbox": {
          "x0": 0.0706,
          "y0": 0.8077,
          "x1": 0.3326,
          "y1": 0.8742
        }
      },
      {
        "id": "request_documents",
        "text": "追加提出を依頼",
        "node_type": "end",
        "bbox": {
          "x0": 0.3696,
          "y0": 0.8077,
          "x1": 0.63,
          "y1": 0.8742
        }
      },
      {
        "id": "eligible",
        "text": "支給対象",
        "node_type": "end",
        "bbox": {
          "x0": 0.6669,
          "y0": 0.8077,
          "x1": 0.929,
          "y1": 0.8742
        }
      }
    ],
    "edges": [
      {
        "from": "start",
        "to": "employee",
        "condition": null,
        "bbox": {
          "x0": 0.4872,
          "y0": 0.1782,
          "x1": 0.5124,
          "y1": 0.2197
        }
      },
      {
        "from": "employee",
        "to": "not_eligible",
        "condition": "いいえ",
        "bbox": {
          "x0": 0.1881,
          "y0": 0.2649,
          "x1": 0.3444,
          "y1": 0.8077
        }
      },
      {
        "from": "employee",
        "to": "documents",
        "condition": "はい",
        "bbox": {
          "x0": 0.4872,
          "y0": 0.3266,
          "x1": 0.5376,
          "y1": 0.3801
        }
      },
      {
        "from": "documents",
        "to": "request_documents",
        "condition": "いいえ",
        "bbox": {
          "x0": 0.4872,
          "y0": 0.4252,
          "x1": 0.7761,
          "y1": 0.8077
        }
      },
      {
        "from": "documents",
        "to": "requirements",
        "condition": "はい",
        "bbox": {
          "x0": 0.4872,
          "y0": 0.487,
          "x1": 0.5376,
          "y1": 0.5405
        }
      },
      {
        "from": "requirements",
        "to": "not_eligible",
        "condition": "いいえ",
        "bbox": {
          "x0": 0.1881,
          "y0": 0.5856,
          "x1": 0.3444,
          "y1": 0.8077
        }
      },
      {
        "from": "requirements",
        "to": "eligible",
        "condition": "はい",
        "bbox": {
          "x0": 0.6552,
          "y0": 0.5856,
          "x1": 0.8114,
          "y1": 0.8077
        }
      }
    ]
  }
}
